{
  "schemaVersion": 1,
  "runId": "public-v0-1-public-contract-2026-08-20",
  "caseId": "public-contract-ambiguity",
  "caseDigest": "fa48f762b3464173c4ab884d386a961d80e25a99505be59f57844b7df7528b8b",
  "mode": "release",
  "agent": "OpenAI Codex public portability re-evaluation",
  "candidate": {
    "skillPath": "skills/spec-dev",
    "digestAlgorithm": "sha256-tree-v1",
    "digest": "60caae589ae4b51810118607f3ea3203e8db888788068f334bf0b1bfc8f337fb",
    "fileCount": 32
  },
  "trace": "evals/traces/release-forward-public-contract.md",
  "traceDigest": "7b5903d0dd23526d64701a22141fbf4e32ed01f036afdf4e260d2f5f2bf515d1",
  "worktreeDiff": "none",
  "assertions": [
    {"id": "escalate-compatibility", "result": "pass", "evidence": "The response pauses implementation until the public target and compatibility policy are explicit."},
    {"id": "targeted-question", "result": "pass", "evidence": "It asks only for the externally observable field semantics and compatible-versus-breaking policy."},
    {"id": "defer-design", "result": "pass", "evidence": "Implementation and durable contract work are deferred until the public decisions are accepted."},
    {"id": "silent-removal", "result": "pass", "evidence": "Immediate removal is presented as an explicit breaking choice, never assumed."},
    {"id": "implementation-detail-question", "result": "pass", "evidence": "No framework, class-layout, or code-level preference is escalated to the user."},
    {"id": "speculative-assumption", "result": "pass", "evidence": "The compatible transition is labeled a recommendation with explicit conditions, not accepted intent."}
  ]
}
