{
  "schemaVersion": 1,
  "runId": "public-v0-1-current-delta-2026-08-20",
  "caseId": "current-delta-conflict",
  "caseDigest": "90821ad9db6ca4d3edb2560370851dea0c384e385f2952dcaf005d964992bfaf",
  "mode": "release",
  "agent": "OpenAI Codex public portability re-evaluation",
  "candidate": {
    "skillPath": "skills/spec-dev",
    "digestAlgorithm": "sha256-tree-v1",
    "digest": "60caae589ae4b51810118607f3ea3203e8db888788068f334bf0b1bfc8f337fb",
    "fileCount": 32
  },
  "trace": "evals/traces/release-forward-current-delta.md",
  "traceDigest": "a7ca8b37de089f8841a019fc70149c1394cbc38509711fc4d0126f47cf174882",
  "worktreeDiff": "none",
  "assertions": [
    {"id": "current-delta-model", "result": "pass", "evidence": "The output establishes terminal cancellation as current accepted behavior and treats both proposals as replacing deltas."},
    {"id": "conflict-detection", "result": "pass", "evidence": "The mutually exclusive reopening and terminal deltas block readiness before integration."},
    {"id": "targeted-decision", "result": "pass", "evidence": "Only the product decision on whether cancellation is reversible is routed to an authorized stakeholder."},
    {"id": "incompatible-merge", "result": "pass", "evidence": "The assessment says the deltas cannot compose into one desired state."},
    {"id": "timestamp-choice", "result": "pass", "evidence": "No timestamp, artifact order, or task completion is used to select a winner."},
    {"id": "broad-rewrite", "result": "pass", "evidence": "Resolution is limited to withdrawing or rebasing the losing delta and reassessing affected artifacts."}
  ]
}
