{
  "schemaVersion": 1,
  "runId": "public-v0-1-bugfix-2026-08-20",
  "caseId": "bugfix-regression",
  "caseDigest": "a58d337fd2e89d298902d540fb0feed1f6a52422dbf0e7e33be21b127aaf1354",
  "mode": "release",
  "agent": "OpenAI Codex public portability re-evaluation",
  "candidate": {
    "skillPath": "skills/spec-dev",
    "digestAlgorithm": "sha256-tree-v1",
    "digest": "fb841ccea3b29ba2cc11c2ea467e3b660baccaddcdbf2b3856b78e5e0a345586",
    "fileCount": 33
  },
  "trace": "evals/traces/release-forward-bugfix.md",
  "traceDigest": "be95f05415fa8a186280c66b7d4d57066337198719983218352a076b9f871a52",
  "assertions": [
    {"id": "behavior-contract", "result": "pass", "evidence": "The plan separates reported, expected, and unchanged behavior for name, email, and password handling."},
    {"id": "root-cause-integrity", "result": "pass", "evidence": "SQL interpolation remains a hypothesis until reproduction and causal evidence exist."},
    {"id": "regression-evidence", "result": "pass", "evidence": "The plan requires red-before/green-after and focused unchanged-behavior verification."},
    {"id": "proportionate-artifacts", "result": "pass", "evidence": "It retains a focused regression test, minimal fix, and concise bugfix record while rejecting unjustified design/task documents."},
    {"id": "guessed-root-cause", "result": "pass", "evidence": "The suspected SQL mechanism is never promoted to a finding without observations."},
    {"id": "feature-misclassification", "result": "pass", "evidence": "The plan first checks whether current accepted display-name rules already permit apostrophes."},
    {"id": "false-verification", "result": "pass", "evidence": "Completion remains conditional on executed reproduction, causal, regression, and unchanged-behavior evidence."}
  ],
  "notes": "Revalidated after adding the user-facing README; normative agent instructions and recorded trace content are unchanged."
}
